{
  "$schema": "https://w3id.org/qi-vc/schemas/v1/digital-calibration-certificate.json",
  "@context": [
    "https://www.w3.org/ns/credentials/v2",
    "https://w3id.org/qi-vc/contexts/v1/qi-evidence-context.jsonld",
    "https://w3id.org/qi-vc/contexts/v1/qi-calibration.jsonld"
  ],
  "type": [
    "VerifiableCredential",
    "DigitalCalibrationCertificate"
  ],
  "id": "urn:uuid:dcc-nmi-001",
  "issuer": "did:web:nmi.example",
  "validFrom": "2026-01-15T00:00:00Z",
  "credentialSchema": {
    "id": "https://w3id.org/qi-vc/schemas/v1/digital-calibration-certificate.json",
    "type": "JsonSchema"
  },
  "credentialSubject": {
    "id": "urn:example:item:pressure-001",
    "administrativeData": {
      "coreData": {
        "uniqueIdentifier": "dcc-nmi-001",
        "beginPerformanceDate": "2026-01-14T08:00:00Z",
        "endPerformanceDate": "2026-01-14T16:00:00Z"
      },
      "items": [
        {
          "name": "Pressure transmitter"
        }
      ],
      "calibrationLaboratory": {
        "id": "did:web:nmi.example",
        "name": "Calibration laboratory"
      },
      "customer": {
        "name": "Example customer"
      }
    },
    "measurementResults": [
      {
        "measurand": "Pressure",
        "usedMethods": [
          {
            "name": "Pressure calibration",
            "reference": "EURAMET cg-17"
          }
        ],
        "results": [
          {
            "name": "Pressure at nominal point",
            "data": {
              "quantity": {
                "quantityKind": "http://qudt.org/vocab/quantitykind/Pressure",
                "value": 500,
                "unit": {
                  "ucumCode": "kPa"
                },
                "uncertainty": {
                  "expandedUncertainty": 1,
                  "coverageFactor": 2
                }
              }
            }
          }
        ]
      }
    ]
  },
  "evidence": [
    {
      "type": "CredentialEvidenceReference",
      "id": "urn:uuid:nmi-legal-mandate-001",
      "relation": "authorizedBy",
      "authorizationBasis": {
        "kind": "legalMandate",
        "issuerRole": "nationalMetrologyInstitute",
        "legalBasis": "Units and Time Act"
      },
      "digestSRI": "sha384-5kXgKru+r1r4oZZFqYH272DGCjvfDHjyrilqQ9+WPWrD0BGIiW7qtiao6xE0d9i6"
    }
  ],
  "proof": {
    "type": "DataIntegrityProof",
    "cryptosuite": "eddsa-rdfc-2022",
    "proofPurpose": "assertionMethod",
    "verificationMethod": "did:web:nmi.example#key-1",
    "created": "2026-01-01T00:00:00Z",
    "proofValue": "zPlaceholderProof"
  }
}
